{
  "schema_version": "1.0.0",
  "plan_id": "lcnd-plan-20260812-egress-cn-synthetic",
  "workload_id": "lcnd-egress-cn",
  "purpose": "lcnd_egress_cn",
  "evidence_mode": "synthetic",
  "probes": [
    {"probe_id": "direct-application", "class": "direct_application_probe", "route": {"id": "direct", "class": "direct"}, "target": {"host": "direct.example.invalid", "port": 443, "protocol": "https"}, "samples": 3, "timeouts": {"connect_ms": 3000, "request_ms": 30000, "idle_ms": 60000}},
    {"probe_id": "egress-application", "class": "egress_application_probe", "route": {"id": "lcnd-egress-cn", "class": "china_egress"}, "target": {"host": "egress.example.invalid", "port": 443, "protocol": "https"}, "samples": 3, "timeouts": {"connect_ms": 3000, "request_ms": 30000, "idle_ms": 60000}},
    {"probe_id": "protected-target", "class": "protected_target_probe", "route": {"id": "direct", "class": "direct"}, "target": {"host": "protected.example.invalid", "port": 443, "protocol": "https"}, "samples": 3, "timeouts": {"connect_ms": 3000, "request_ms": 30000, "idle_ms": 60000}},
    {"probe_id": "secret-leak", "class": "secret_leak_probe", "route": {"id": "lcnd-egress-cn", "class": "china_egress"}, "target": {"host": "redaction.example.invalid", "port": 443, "protocol": "https"}, "samples": 3, "timeouts": {"connect_ms": 3000, "request_ms": 30000, "idle_ms": 60000}}
  ]
}
